,text,gloss
0,How are you today?,"TODAY, HOW ARE YOU?"
1,What's your favorite food?,"FAVORITE FOOD, WHAT?"
2,Where did you go on vacation?,"VACATION WHERE, YOU GO?"
3,Did you watch the game last night?,"GAME LAST NIGHT, YOU WATCH?"
4,How's work going?,"WORK, HOW GO?"
5,Have you read any good books lately?,"BOOK GOOD READ, YOU HAVE?"
6,What time is it?,TIME WHAT?
7,Do you have any plans for the weekend?,"WEEKEND PLAN, YOU HAVE?"
8,Did you hear about the new restaurant?,"NEW RESTAURANT, YOU HEAR?"
9,Are you feeling better?,"BETTER, YOU FEEL?"
10,"Can you pass me the salt, please?","SALT PASS ME, PLEASE."
11,What's the weather like today?,"TODAY WEATHER, HOW?"
12,Do you need any help?,"HELP NEED, YOU?"
13,How was your day?,"DAY, HOW WAS?"
14,What do you do for fun?,"FUN DO, YOU HAVE?"
15,Are you busy right now?,"NOW BUSY, YOU ARE?"
16,Have you seen that movie?,"MOVIE SEE, YOU?"
17,What's your favorite color?,"FAVORITE COLOR, WHAT?"
18,Would you like some coffee?,"COFFEE WANT, YOU?"
19,Are you going to the party?,"PARTY GO, YOU?"
20,What's your favorite TV show?,"TV SHOW FAVORITE, WHAT?"
21,Did you have a good weekend?,"WEEKEND GOOD, YOU HAVE?"
22,Where did you grow up?,"GROW UP, WHERE?"
23,What's your dream job?,"JOB DREAM, WHAT?"
24,Do you have any pets?,"PET HAVE, YOU?"
25,How's your family doing?,"FAMILY HOW, THEY?"
26,Did you enjoy the concert?,"CONCERT ENJOY, YOU?"
27,What's your favorite sport?,"SPORT FAVORITE, WHAT?"
28,Are you feeling tired?,"TIRED, YOU FEEL?"
29,What's your favorite season?,"SEASON FAVORITE, WHAT?"
30,Do you have any siblings?,"SIBLING HAVE, YOU?"
31,How's the new job going?,"NEW JOB, HOW GO?"
32,What's your favorite hobby?,"HOBBY FAVORITE, WHAT?"
33,Are you hungry?,"HUNGRY, YOU?"
34,What's your favorite movie genre?,"MOVIE GENRE FAVORITE, WHAT?"
35,Do you like to travel?,"TRAVEL LIKE, YOU?"
36,How's your day been so far?,"DAY, HOW BEEN?"
37,What's your favorite restaurant?,"RESTAURANT FAVORITE, WHAT?"
38,Have you ever been abroad?,"ABROAD GO, YOU BEFORE?"
39,What's your favorite holiday?,"HOLIDAY FAVORITE, WHAT?"
40,Do you prefer tea or coffee?,"TEA COFFEE, WHICH PREFER?"
41,How's your weekend going?,"WEEKEND, HOW GO?"
42,Do you like to cook?,"COOK LIKE, YOU?"
43,What's your favorite book genre?,"BOOK GENRE FAVORITE, WHAT?"
44,Did you have a good sleep?,"SLEEP GOOD, YOU HAVE?"
45,How do you like your steak cooked?,"STEAK HOW COOK, YOU LIKE?"
46,Are you excited about the trip?,"TRIP EXCITED, YOU ARE?"
47,What's your favorite dessert?,"DESSERT FAVORITE, WHAT?"
48,Did you have a good commute?,"COMMUTE GOOD, YOU HAVE?"
49,What's your favorite childhood memory?,"CHILDHOOD MEMORY FAVORITE, WHAT?"
0,Spending time outdoors has numerous benefits for both physical and mental health,"OUTDOORS SPEND TIME BENEFIT MANY, PHYSICAL, MENTAL HEALTH."
1, The fresh air and natural light can improve mood and increase energy levels,"FRESH AIR, NATURAL LIGHT IMPROVE MOOD, INCREASE ENERGY."
2," Engaging in physical activities like walking, jogging, or cycling helps maintain a healthy weight, strengthens muscles, and improves cardiovascular health","PHYSICAL ACTIVITY WALK, JOG, CYCLE HELP HEALTHY WEIGHT, STRONG MUSCLES, BETTER HEART HEALTH."
3," Moreover, being in nature reduces stress and anxiety, promoting a sense of calm and well-being","BE IN NATURE REDUCE STRESS, ANXIETY, PROMOTE CALM, WELL-BEING."
4, Social interactions that often occur during outdoor activities can enhance emotional health by reducing feelings of loneliness and depression,"SOCIAL INTERACT OUTDOORS IMPROVE EMOTIONAL HEALTH, LESS LONELY, LESS DEPRESSION."
5," Children, in particular, benefit greatly from playing outside.  It encourages creativity, improves social skills, and fosters a sense of independence","CHILDREN BENEFIT PLAY OUTSIDE, ENCOURAGE CREATIVITY, BETTER SOCIAL SKILLS, MORE INDEPENDENCE."
6," Additionally, exposure to sunlight helps the body produce vitamin D, which is essential for bone health","SUNLIGHT HELP BODY MAKE VITAMIN D, GOOD FOR BONES."
7, Studies have shown that people who spend more time outdoors tend to have better sleep patterns and overall improved quality of life,"STUDIES SHOW PEOPLE SPEND MORE TIME OUTDOORS SLEEP BETTER, BETTER LIFE QUALITY."
8," In our fast-paced, technology-driven world, it's easy to forget the simple pleasure of being in nature","FAST-PACED TECHNOLOGY WORLD, EASY FORGET NATURE SIMPLE PLEASURE."
9," However, making a conscious effort to spend more time outside can lead to significant improvements in health and happiness","CONSCIOUS EFFORT SPEND MORE TIME OUTSIDE, IMPROVE HEALTH, HAPPINESS."
10," Whether it's a walk in the park, a hike in the mountains, or just sitting in a garden, the benefits of spending time outdoors are undeniable","WALK PARK, HIKE MOUNTAIN, SIT GARDEN, OUTDOORS BENEFIT UNDENIABLE."
11, It's important to make outdoor activities a regular part of our routine to reap these benefits fully,"IMPORTANT MAKE OUTDOOR ACTIVITY REGULAR ROUTINE, REAP BENEFIT."
12," So, take a moment to step outside, breathe deeply, and enjoy the natural world around you","TAKE MOMENT STEP OUTSIDE, BREATHE DEEP, ENJOY NATURE AROUND."
13, Your mind and body will thank you,"MIND, BODY THANK YOU."
14,Exploring new cultures and places has always been an enriching experience for many people,"NEW CULTURES, PLACES EXPLORE, ENRICH EXPERIENCE MANY PEOPLE."
15," Traveling allows individuals to step out of their comfort zones and immerse themselves in different environments, learning about diverse traditions, languages, and lifestyles","TRAVEL ALLOW STEP OUT COMFORT ZONE, IMMERSE DIFFERENT ENVIRONMENTS, LEARN TRADITIONS, LANGUAGES, LIFESTYLES."
16, This exposure broadens perspectives and fosters a deeper understanding and appreciation of the worldís diversity,"EXPOSURE BROADEN PERSPECTIVES, DEEPER UNDERSTAND, APPRECIATE WORLD DIVERSITY."
17, One of the greatest benefits of travel is the opportunity it provides for personal growth,TRAVEL BENEFIT PERSONAL GROWTH.
18," By navigating unfamiliar territories and adapting to new situations, travelers develop resilience, adaptability, and problem-solving skills","NAVIGATE UNFAMILIAR TERRITORIES, ADAPT NEW SITUATIONS, DEVELOP RESILIENCE, ADAPTABILITY, PROBLEM-SOLVE SKILLS."
19," Moreover, travel often involves interacting with people from various backgrounds, which enhances social skills and cultural empathy","INTERACT PEOPLE DIFFERENT BACKGROUNDS, ENHANCE SOCIAL SKILLS, CULTURAL EMPATHY."
20,"Visiting historical landmarks and museums can also provide a profound educational experience, allowing travelers to connect with the past and gain insights into the events that have shaped our world","VISIT HISTORICAL LANDMARKS, MUSEUMS PROVIDE EDUCATIONAL EXPERIENCE, CONNECT PAST, UNDERSTAND EVENTS SHAPE WORLD."
21," Similarly, exploring natural wonders like mountains, forests, and oceans can inspire awe and a sense of responsibility towards environmental conservation","EXPLORE NATURAL WONDERS MOUNTAINS, FORESTS, OCEANS, INSPIRE AWE, RESPONSIBILITY ENVIRONMENTAL CONSERVATION."
22," These experiences can be life-changing, leaving a lasting impact on oneís worldview and values","EXPERIENCES LIFE-CHANGING, LASTING IMPACT WORLDVIEW, VALUES."
23,"In addition to personal enrichment, travel can significantly benefit physical health",TRAVEL BENEFIT PHYSICAL HEALTH.
24," Activities such as hiking, swimming, and walking tours promote physical fitness and can be a fun way to stay active","HIKING, SWIMMING, WALKING TOURS PROMOTE FITNESS, FUN STAY ACTIVE."
25," The mental health benefits are equally significant, as traveling can reduce stress, improve mood, and increase overall happiness","MENTAL HEALTH BENEFITS, REDUCE STRESS, IMPROVE MOOD, INCREASE HAPPINESS."
26," Breaking away from the routine and experiencing new sights and sounds can rejuvenate the mind and body, providing a much-needed break from the daily grind","BREAK ROUTINE, EXPERIENCE NEW SIGHTS, SOUNDS, REJUVENATE MIND, BODY, BREAK DAILY GRIND."
27,Travel also plays a crucial role in the global economy,TRAVEL IMPORTANT GLOBAL ECONOMY.
28," Tourism creates jobs, supports local businesses, and generates revenue for communities","TOURISM CREATE JOBS, SUPPORT LOCAL BUSINESS, GENERATE REVENUE COMMUNITIES."
29," This economic boost can lead to improved infrastructure and services, benefiting both residents and visitors","ECONOMIC BOOST IMPROVE INFRASTRUCTURE, SERVICES, BENEFIT RESIDENTS, VISITORS."
30, Sustainable tourism practices are essential to ensure that travel benefits do not come at the expense of the environment or local cultures,"SUSTAINABLE TOURISM IMPORTANT, ENSURE BENEFIT, NOT HARM ENVIRONMENT, LOCAL CULTURES."
31, Responsible travelers make a conscious effort to minimize their environmental footprint and respect local customs and traditions,"RESPONSIBLE TRAVELERS MINIMIZE ENVIRONMENTAL FOOTPRINT, RESPECT LOCAL CUSTOMS, TRADITIONS."
32,"In conclusion, traveling is much more than just a leisure activity","CONCLUSION, TRAVEL MORE THAN LEISURE ACTIVITY."
33," It is a powerful tool for education, personal development, and cultural exchange","TRAVEL POWERFUL TOOL EDUCATION, PERSONAL DEVELOPMENT, CULTURAL EXCHANGE."
34," Whether exploring a new city, trekking through a national park, or relaxing on a beach, travel offers countless opportunities to learn, grow, and connect with the world around us","EXPLORE NEW CITY, TREK NATIONAL PARK, RELAX BEACH, TRAVEL OFFER LEARN, GROW, CONNECT WORLD."
35," As we embrace the wonders of travel, it is important to do so responsibly, ensuring that our adventures contribute positively to the places we visit and the people we meet","EMBRACE TRAVEL WONDERS, IMPORTANT RESPONSIBLY, POSITIVE IMPACT PLACES VISIT, PEOPLE MEET."
36," By traveling mindfully and respectfully, we can enjoy the many benefits of exploration while fostering a more connected and compassionate global community","TRAVEL MINDFULLY, RESPECTFULLY, BENEFIT EXPLORATION, FOSTER CONNECTED, COMPASSIONATE GLOBAL COMMUNITY."
37,Reading books is a wonderful hobby,READ BOOKS WONDERFUL HOBBY.
38, It allows people to explore different worlds,ALLOW PEOPLE EXPLORE DIFFERENT WORLDS.
39," Books can be full of adventure, mystery, or romance","BOOKS FULL ADVENTURE, MYSTERY, ROMANCE."
40, Reading improves vocabulary and language skills,"READ IMPROVE VOCABULARY, LANGUAGE SKILLS."
41, It also stimulates the mind and imagination,"STIMULATE MIND, IMAGINATION."
42, People can learn new things from books,PEOPLE LEARN NEW THINGS FROM BOOKS.
43, Reading can be a great way to relax and unwind,"READ GREAT WAY RELAX, UNWIND."
44, It provides a break from the stresses of daily life,PROVIDE BREAK FROM DAILY LIFE STRESS.
45, Books can be enjoyed alone or shared with others,"BOOKS ENJOY ALONE, SHARE WITH OTHERS."
46, Joining a book club is a fun way to discuss stories,JOIN BOOK CLUB FUN WAY DISCUSS STORIES.
47, Children who read often perform better in school,CHILDREN READ OFTEN PERFORM BETTER SCHOOL.
48, They develop strong comprehension skills,DEVELOP STRONG COMPREHENSION SKILLS.
49, Reading helps build empathy by showing different perspectives,"READ HELP BUILD EMPATHY, SHOW DIFFERENT PERSPECTIVES."
50, Libraries offer a wide range of books for free,LIBRARIES OFFER WIDE RANGE BOOKS FREE.
51, Everyone can find something they enjoy reading,EVERYONE FIND SOMETHING ENJOY READ.
52, Technology has made books more accessible,TECHNOLOGY MAKE BOOKS MORE ACCESSIBLE.
53, E-books and audiobooks are popular alternatives,"E-BOOKS, AUDIOBOOKS POPULAR ALTERNATIVES."
54, People can read or listen to books on the go,"PEOPLE READ, LISTEN BOOKS ON THE GO."
55, Reading before bedtime can improve sleep,READ BEFORE BEDTIME IMPROVE SLEEP.
56, Itís a calming way to end the day,CALM WAY END DAY.
57," Overall, reading is a beneficial and enjoyable activity","OVERALL, READING BENEFICIAL, ENJOYABLE ACTIVITY."
58,Books can transport readers to different times and places,"BOOKS TRANSPORT READERS DIFFERENT TIMES, PLACES."
59, Historical novels can teach about past events,HISTORICAL NOVELS TEACH PAST EVENTS.
60, Science fiction books explore futuristic ideas,SCIENCE FICTION BOOKS EXPLORE FUTURE IDEAS.
61, Fantasy books create magical worlds,FANTASY BOOKS CREATE MAGICAL WORLDS.
62, Non-fiction books provide factual information,NON-FICTION BOOKS PROVIDE FACTUAL INFORMATION.
63, Biographies tell the stories of real people's lives,BIOGRAPHIES TELL STORIES REAL PEOPLE LIVES.
64, Self-help books offer advice for personal growth,SELF-HELP BOOKS OFFER ADVICE PERSONAL GROWTH.
65, Cookbooks give recipes for delicious meals,COOKBOOKS GIVE RECIPES DELICIOUS MEALS.
66, Travel books describe interesting destinations,TRAVEL BOOKS DESCRIBE INTERESTING DESTINATIONS.
67, There is a book for every interest and age group,"BOOK FOR EVERY INTEREST, AGE GROUP."
68, Reading can be a lifelong passion,READING CAN BE LIFELONG PASSION.
69, It can be started at any age,START ANY AGE.
70, Parents can read to their children to instill a love of reading,PARENTS READ TO CHILDREN INSTILL LOVE READING.
71, Storytime can be a special bonding activity,STORYTIME SPECIAL BONDING ACTIVITY.
72, Schools often encourage reading through programs and libraries,"SCHOOLS ENCOURAGE READING PROGRAMS, LIBRARIES."
73, Reading can also be a social activity,READING CAN BE SOCIAL ACTIVITY.
74, Book clubs and reading groups bring people together,"BOOK CLUBS, READING GROUPS BRING PEOPLE TOGETHER."
75, They can share insights and discuss their favorite books,"SHARE INSIGHTS, DISCUSS FAVORITE BOOKS."
76, Community events like book fairs promote reading,COMMUNITY EVENTS LIKE BOOK FAIRS PROMOTE READING.
77,"In the digital age, reading has evolved","DIGITAL AGE, READING EVOLVED."
78, E-books can be downloaded instantly,E-BOOKS DOWNLOAD INSTANTLY.
79, This makes it easy to access a variety of books,EASY ACCESS VARIETY BOOKS.
80, Audiobooks allow people to enjoy stories while multitasking,AUDIOBOOKS ENJOY STORIES WHILE MULTITASKING.
81," They can listen while driving, exercising, or doing chores","LISTEN WHILE DRIVING, EXERCISING, DOING CHORES."
82, Digital libraries offer thousands of titles,DIGITAL LIBRARIES OFFER THOUSANDS TITLES.
83, This makes reading convenient and flexible,"READING CONVENIENT, FLEXIBLE."
84, Online platforms recommend books based on past reads,ONLINE PLATFORMS RECOMMEND BOOKS BASED ON PAST READS.
85, This helps people discover new authors and genres,"HELP DISCOVER NEW AUTHORS, GENRES."
86, Reading apps can track progress and set goals,"READING APPS TRACK PROGRESS, SET GOALS."
87, Some apps offer interactive features like notes and highlights,"SOME APPS OFFER INTERACTIVE FEATURES LIKE NOTES, HIGHLIGHTS."
88, These tools enhance the reading experience,TOOLS ENHANCE READING EXPERIENCE.
89,Reading has many health benefits,READING HEALTH BENEFITS.
90, It reduces stress and lowers blood pressure,"REDUCE STRESS, LOWER BLOOD PRESSURE."
91, It can even improve mental health,IMPROVE MENTAL HEALTH.
92, Reading regularly can prevent cognitive decline,READING REGULARLY PREVENT COGNITIVE DECLINE.
93, It keeps the brain active and engaged,"KEEP BRAIN ACTIVE, ENGAGED."
94, Fiction books can boost creativity,FICTION BOOKS BOOST CREATIVITY.
95, They inspire new ideas and perspectives,"INSPIRE NEW IDEAS, PERSPECTIVES."
96, Reading also improves focus and concentration,"READ IMPROVE FOCUS, CONCENTRATION."
97, It requires attention to detail and comprehension,"REQUIRE ATTENTION TO DETAIL, COMPREHENSION."
98, Developing these skills is useful in everyday life,DEVELOP SKILLS USEFUL IN EVERYDAY LIFE.
99, Reading can be a productive use of free time,READING PRODUCTIVE USE FREE TIME.
100, It offers endless opportunities for learning and growth,"OFFERS ENDLESS OPPORTUNITIES LEARN, GROW."
101," Whether reading for pleasure or education, the benefits are clear","WHETHER READ FOR PLEASURE OR EDUCATION, BENEFITS CLEAR."
102, Reading enriches life in many ways,READING ENRICH LIFE MANY WAYS.
103, It is a hobby that can be enjoyed anywhere and anytime,"HOBBY ENJOY ANYWHERE, ANYTIME."
104, The love of reading can be passed down through generations,LOVE READING PASS DOWN GENERATIONS.
105, Encouraging others to read can create a community of lifelong learners,ENCOURAGE OTHERS TO READ CREATE COMMUNITY LIFELONG LEARNERS.
106,Working in an office can be both challenging and rewarding,"WORK OFFICE CHALLENGING, REWARDING."
107," Daily tasks often include checking emails, attending meetings, and completing projects","DAILY TASKS INCLUDE CHECK EMAILS, ATTEND MEETINGS, COMPLETE PROJECTS."
108, Organization is key to managing time effectively,ORGANIZATION KEY MANAGE TIME EFFECTIVELY.
109, Keeping a to-do list helps prioritize tasks,KEEP TO-DO LIST HELP PRIORITIZE TASKS.
110, Using calendars and reminders ensures deadlines are met,"USE CALENDARS, REMINDERS ENSURE DEADLINES MET."
111, Team collaboration is crucial for success,TEAM COLLABORATION CRUCIAL SUCCESS.
112, Communicating clearly with colleagues prevents misunderstandings,COMMUNICATE CLEARLY WITH COLLEAGUES PREVENT MISUNDERSTANDINGS.
113, Regular meetings keep everyone updated on progress,REGULAR MEETINGS KEEP EVERYONE UPDATED PROGRESS.
114, Problem-solving skills are important when facing obstacles,PROBLEM-SOLVING SKILLS IMPORTANT FACE OBSTACLES.
115, Staying focused and avoiding distractions improves productivity,"STAY FOCUSED, AVOID DISTRACTIONS IMPROVE PRODUCTIVITY."
116, Taking short breaks helps maintain energy levels,TAKE SHORT BREAKS MAINTAIN ENERGY LEVELS.
117, Office environments can vary greatly,OFFICE ENVIRONMENTS VARY GREATLY.
118," Some are quiet and private, while others are open and noisy","SOME QUIET, PRIVATE, OTHERS OPEN, NOISY."
119, Personalizing your workspace can make it more comfortable,PERSONALIZE WORKSPACE MAKE MORE COMFORTABLE.
120, Ergonomic furniture is essential for good posture,ERGONOMIC FURNITURE ESSENTIAL GOOD POSTURE.
121, Proper lighting reduces eye strain,PROPER LIGHTING REDUCE EYE STRAIN.
122, Access to necessary tools and resources is important,"ACCESS NECESSARY TOOLS, RESOURCES IMPORTANT."
123, Technology plays a big role in modern offices,TECHNOLOGY BIG ROLE MODERN OFFICES.
124," Computers, printers, and phones are common tools","COMPUTERS, PRINTERS, PHONES COMMON TOOLS."
125, Software applications help with various tasks,SOFTWARE APPLICATIONS HELP VARIOUS TASKS.
126, Cloud storage makes file sharing easier,CLOUD STORAGE MAKE FILE SHARING EASIER.
127, Cybersecurity is important to protect sensitive information,CYBERSECURITY IMPORTANT PROTECT SENSITIVE INFORMATION.
128, Following company policies ensures a safe work environment,FOLLOW COMPANY POLICIES ENSURE SAFE WORK ENVIRONMENT.
129,Work-life balance is vital for overall well-being,WORK-LIFE BALANCE VITAL OVERALL WELL-BEING.
130, Setting boundaries between work and personal time prevents burnout,"SET BOUNDARIES BETWEEN WORK, PERSONAL TIME PREVENT BURNOUT."
131, Flexible work hours can help manage responsibilities,FLEXIBLE WORK HOURS HELP MANAGE RESPONSIBILITIES.
132, Remote work has become more common,REMOTE WORK BECOME MORE COMMON.
133, It offers convenience but requires discipline,"OFFERS CONVENIENCE, REQUIRE DISCIPLINE."
134, Staying connected with the team is important when working remotely,STAY CONNECTED WITH TEAM IMPORTANT REMOTE WORK.
135, Video calls and messaging apps facilitate communication,"VIDEO CALLS, MESSAGING APPS FACILITATE COMMUNICATION."
136, Professional development is important for career growth,PROFESSIONAL DEVELOPMENT IMPORTANT CAREER GROWTH.
137, Attending workshops and training sessions enhances skills,"ATTEND WORKSHOPS, TRAINING SESSIONS ENHANCE SKILLS."
138, Setting career goals motivates continuous improvement,SET CAREER GOALS MOTIVATE CONTINUOUS IMPROVEMENT.
139, Networking with others in the industry can open opportunities,NETWORKING OTHERS INDUSTRY OPEN OPPORTUNITIES.
140, Mentoring relationships provide guidance and support,"MENTORING RELATIONSHIPS PROVIDE GUIDANCE, SUPPORT."
141, Feedback from supervisors helps improve performance,FEEDBACK FROM SUPERVISORS HELP IMPROVE PERFORMANCE.
142, Recognizing and celebrating achievements boosts morale,"RECOGNIZE, CELEBRATE ACHIEVEMENTS BOOST MORALE."
143, Office events and team-building activities foster a positive atmosphere,"OFFICE EVENTS, TEAM-BUILDING ACTIVITIES FOSTER POSITIVE ATMOSPHERE."
144, Maintaining a healthy lifestyle benefits work performance,MAINTAIN HEALTHY LIFESTYLE BENEFIT WORK PERFORMANCE.
145," Regular exercise, a balanced diet, and adequate sleep are crucial","REGULAR EXERCISE, BALANCED DIET, ADEQUATE SLEEP CRUCIAL."
146, Stress management techniques like meditation can be helpful,STRESS MANAGEMENT TECHNIQUES LIKE MEDITATION HELPFUL.
147,Effective time management increases efficiency,EFFECTIVE TIME MANAGEMENT INCREASE EFFICIENCY.
148, Prioritizing tasks based on importance and deadlines is essential,"PRIORITIZE TASKS BASED IMPORTANCE, DEADLINES ESSENTIAL."
149, Delegating tasks when necessary ensures workload is manageable,DELEGATE TASKS WHEN NECESSARY ENSURE WORKLOAD MANAGEABLE.
150, Using productivity tools can streamline work processes,USE PRODUCTIVITY TOOLS STREAMLINE WORK PROCESSES.
151, Staying organized prevents last-minute rushes,STAY ORGANIZED PREVENT LAST-MINUTE RUSHES.
152, Multitasking can sometimes be counterproductive,MULTITASKING SOMETIMES COUNTERPRODUCTIVE.
153, Focusing on one task at a time may yield better results,FOCUS ONE TASK AT A TIME BETTER RESULTS.
154, Keeping track of accomplishments provides a sense of progress,KEEP TRACK ACCOMPLISHMENTS PROVIDE SENSE PROGRESS.
155, Regularly reviewing goals keeps you on track,REGULARLY REVIEW GOALS KEEP ON TRACK.
156, Flexibility is important when unexpected tasks arise,FLEXIBILITY IMPORTANT WHEN UNEXPECTED TASKS ARISE.
157, Adapting to changes quickly minimizes disruptions,ADAPT QUICKLY MINIMIZE DISRUPTIONS.
158, Clear and concise communication saves time,"CLEAR, CONCISE COMMUNICATION SAVE TIME."
159, Misunderstandings can lead to mistakes and delays,"MISUNDERSTANDINGS LEAD TO MISTAKES, DELAYS."
160, Listening actively during conversations is crucial,LISTEN ACTIVELY DURING CONVERSATIONS CRUCIAL.
161, It ensures that information is correctly understood,ENSURE INFORMATION CORRECTLY UNDERSTOOD.
162, Maintaining a professional attitude is important,MAINTAIN PROFESSIONAL ATTITUDE IMPORTANT.
163, Being respectful and courteous creates a positive work environment,"BE RESPECTFUL, COURTEOUS CREATE POSITIVE WORK ENVIRONMENT."
164, Constructive feedback should be given and received well,"CONSTRUCTIVE FEEDBACK GIVE, RECEIVE WELL."
165, Encouraging a supportive culture enhances teamwork,ENCOURAGE SUPPORTIVE CULTURE ENHANCE TEAMWORK.
166, Taking initiative shows leadership potential,TAKE INITIATIVE SHOW LEADERSHIP POTENTIAL.
167, Solving problems independently builds confidence,SOLVE PROBLEMS INDEPENDENTLY BUILD CONFIDENCE.
168, Being reliable and dependable earns trust,"BE RELIABLE, DEPENDABLE EARN TRUST."
169, Consistently meeting deadlines and producing quality work is valued,"CONSISTENTLY MEET DEADLINES, PRODUCE QUALITY WORK VALUED."
170, Continuous learning and adapting to new trends is important,"CONTINUOUS LEARNING, ADAPT NEW TRENDS IMPORTANT."
171, Keeping up with industry developments maintains relevance,KEEP UP WITH INDUSTRY DEVELOPMENTS MAINTAIN RELEVANCE.
172, Embracing change positively impacts career growth,EMBRACE CHANGE POSITIVELY IMPACT CAREER GROWTH.
173, Building good relationships with colleagues creates a supportive network,BUILD GOOD RELATIONSHIPS WITH COLLEAGUES CREATE SUPPORTIVE NETWORK.
174, Enjoying work leads to greater job satisfaction,ENJOY WORK LEAD GREATER JOB SATISFACTION.
